{
  "$schema": "http://json-schema.org/draft-07/schema#",
  "$id": "https://github.com/IntersectMBO/UPLC-CAPE/submissions/TEMPLATE/metrics.schema.json",
  "title": "UPLC-CAPE Metrics Schema",
  "description": "Schema for benchmark metrics data in the UPLC-CAPE framework. See doc/metrics.md for comprehensive metric documentation including formulas, protocol parameters, and interpretation guidelines.",
  "type": "object",
  "properties": {
    "scenario": {
      "type": "string",
      "description": "The benchmark scenario name",
      "examples": ["fibonacci", "two_party_escrow", "streaming_payments"]
    },
    "version": {
      "type": "string",
      "enum": ["2.0.0"],
      "description": "Schema version in semantic versioning format",
      "default": "2.0.0"
    },
    "measurements": {
      "type": "object",
      "description": "Aggregated performance measurements from UPLC evaluations",
      "properties": {
        "cpu_units": {
          "type": "object",
          "description": "CPU execution units aggregations over evaluations included in aggregates (included_in_aggregates and not pending)",
          "properties": {
            "maximum": {
              "type": "integer",
              "minimum": 0,
              "description": "Maximum CPU units across included evaluations"
            },
            "sum": {
              "type": "integer",
              "minimum": 0,
              "description": "Sum of CPU units across included evaluations"
            },
            "minimum": {
              "type": "integer",
              "minimum": 0,
              "description": "Minimum CPU units across included evaluations"
            },
            "median": {
              "type": "integer",
              "minimum": 0,
              "description": "Median CPU units across included evaluations"
            }
          },
          "required": ["maximum", "sum", "minimum", "median"],
          "additionalProperties": false
        },
        "memory_units": {
          "type": "object",
          "description": "Memory units aggregations over evaluations included in aggregates (included_in_aggregates and not pending)",
          "properties": {
            "maximum": {
              "type": "integer",
              "minimum": 0,
              "description": "Maximum memory units across included evaluations"
            },
            "sum": {
              "type": "integer",
              "minimum": 0,
              "description": "Sum of memory units across included evaluations"
            },
            "minimum": {
              "type": "integer",
              "minimum": 0,
              "description": "Minimum memory units across included evaluations"
            },
            "median": {
              "type": "integer",
              "minimum": 0,
              "description": "Median memory units across included evaluations"
            }
          },
          "required": ["maximum", "sum", "minimum", "median"],
          "additionalProperties": false
        },
        "script_size_bytes": {
          "type": "integer",
          "minimum": 1,
          "description": "Size of serialized UPLC script in bytes (constant across evaluations)"
        },
        "term_size": {
          "type": "integer",
          "minimum": 1,
          "description": "Number of AST nodes in the UPLC term (constant across evaluations)"
        },
        "execution_fee_lovelace": {
          "type": "integer",
          "minimum": 0,
          "description": "Execution cost in lovelace (CPU + memory cost only, no reference script fee)"
        },
        "reference_script_fee_lovelace": {
          "type": "integer",
          "minimum": 0,
          "description": "Reference script storage cost in lovelace (Conway era tiered pricing)"
        },
        "total_fee_lovelace": {
          "type": "integer",
          "minimum": 0,
          "description": "Total cost in lovelace (execution + reference script fee)"
        },
        "tx_memory_budget_pct": {
          "type": "number",
          "minimum": 0,
          "description": "Percentage of transaction memory budget used"
        },
        "tx_cpu_budget_pct": {
          "type": "number",
          "minimum": 0,
          "description": "Percentage of transaction CPU budget used"
        },
        "block_memory_budget_pct": {
          "type": "number",
          "minimum": 0,
          "description": "Percentage of block memory budget used"
        },
        "block_cpu_budget_pct": {
          "type": "number",
          "minimum": 0,
          "description": "Percentage of block CPU budget used"
        },
        "scripts_per_tx": {
          "type": "integer",
          "minimum": 0,
          "description": "Maximum number of script executions that fit in a single transaction"
        },
        "scripts_per_block": {
          "type": "integer",
          "minimum": 0,
          "description": "Maximum number of script executions that fit in a single block"
        },
        "excluded": {
          "type": "object",
          "description": "Diagnostic totals for evaluations excluded from aggregates (attacks, malformed inputs, defensive checks, pending tests). Always present; count is 0 when nothing is excluded.",
          "properties": {
            "count": {
              "type": "integer",
              "minimum": 0,
              "description": "Number of excluded evaluations"
            },
            "cpu_units": {
              "type": "object",
              "properties": {
                "sum": {
                  "type": "integer",
                  "minimum": 0,
                  "description": "Sum of CPU units across excluded evaluations"
                },
                "maximum": {
                  "type": "integer",
                  "minimum": 0,
                  "description": "Maximum CPU units across excluded evaluations"
                }
              },
              "required": ["sum", "maximum"],
              "additionalProperties": false
            },
            "memory_units": {
              "type": "object",
              "properties": {
                "sum": {
                  "type": "integer",
                  "minimum": 0,
                  "description": "Sum of memory units across excluded evaluations"
                },
                "maximum": {
                  "type": "integer",
                  "minimum": 0,
                  "description": "Maximum memory units across excluded evaluations"
                }
              },
              "required": ["sum", "maximum"],
              "additionalProperties": false
            }
          },
          "required": ["count", "cpu_units", "memory_units"],
          "additionalProperties": false
        }
      },
      "required": [
        "cpu_units",
        "memory_units",
        "script_size_bytes",
        "term_size",
        "execution_fee_lovelace",
        "reference_script_fee_lovelace",
        "total_fee_lovelace",
        "tx_memory_budget_pct",
        "tx_cpu_budget_pct",
        "block_memory_budget_pct",
        "block_cpu_budget_pct",
        "scripts_per_tx",
        "scripts_per_block",
        "excluded"
      ],
      "additionalProperties": false
    },
    "evaluations": {
      "type": "array",
      "description": "Per-evaluation performance measurements",
      "items": {
        "type": "object",
        "properties": {
          "name": {
            "type": "string",
            "description": "Name of the test case"
          },
          "description": {
            "type": "string",
            "description": "Description of what this evaluation tests"
          },
          "cpu_units": {
            "type": "integer",
            "minimum": 0,
            "description": "CPU execution units consumed for this evaluation"
          },
          "memory_units": {
            "type": "integer",
            "minimum": 0,
            "description": "Memory units consumed for this evaluation"
          },
          "execution_result": {
            "type": "string",
            "enum": ["success", "error"],
            "description": "Result of the evaluation execution"
          },
          "included_in_aggregates": {
            "type": "boolean",
            "description": "Effective inclusion in aggregated metrics (the test is a measurement, not a check, AND not pending)"
          }
        },
        "required": [
          "name",
          "description",
          "cpu_units",
          "memory_units",
          "execution_result",
          "included_in_aggregates"
        ],
        "additionalProperties": false
      }
    },
    "execution_environment": {
      "type": "object",
      "description": "Information about the evaluation environment",
      "properties": {
        "evaluator": {
          "type": "string",
          "description": "Name and version of the evaluator used",
          "examples": ["PlutusTx.Eval-1.52.0.0", "plutus-core-executable-1.52.0.0"]
        }
      },
      "required": ["evaluator"],
      "additionalProperties": false
    },
    "timestamp": {
      "type": "string",
      "format": "date-time",
      "description": "ISO-8601 timestamp when measurements were taken"
    },
    "notes": {
      "type": "string",
      "description": "Optional notes about the implementation or measurements"
    }
  },
  "required": [
    "scenario",
    "version",
    "measurements",
    "evaluations",
    "execution_environment",
    "timestamp"
  ],
  "additionalProperties": false
}
