{
  "evaluations": [
    {
      "cpu_units": 471986,
      "description": "Fibonacci of 0 should return 0",
      "execution_result": "success",
      "included_in_aggregates": true,
      "memory_units": 2302,
      "name": "fibonacci_0"
    },
    {
      "cpu_units": 471986,
      "description": "Fibonacci of 1 should return 1",
      "execution_result": "success",
      "included_in_aggregates": true,
      "memory_units": 2302,
      "name": "fibonacci_1"
    },
    {
      "cpu_units": 1149576,
      "description": "Fibonacci of 2 should return 1",
      "execution_result": "success",
      "included_in_aggregates": true,
      "memory_units": 5106,
      "name": "fibonacci_2"
    },
    {
      "cpu_units": 1944374,
      "description": "Fibonacci of 3 should return 2",
      "execution_result": "success",
      "included_in_aggregates": true,
      "memory_units": 8012,
      "name": "fibonacci_3"
    },
    {
      "cpu_units": 3533970,
      "description": "Fibonacci of 5 should return 5",
      "execution_result": "success",
      "included_in_aggregates": true,
      "memory_units": 13824,
      "name": "fibonacci_5"
    },
    {
      "cpu_units": 5918364,
      "description": "Fibonacci of 8 should return 21",
      "execution_result": "success",
      "included_in_aggregates": true,
      "memory_units": 22542,
      "name": "fibonacci_8"
    },
    {
      "cpu_units": 7507960,
      "description": "Fibonacci of 10 should return 55",
      "execution_result": "success",
      "included_in_aggregates": true,
      "memory_units": 28354,
      "name": "fibonacci_10"
    },
    {
      "cpu_units": 11481950,
      "description": "Fibonacci of 15 should return 610",
      "execution_result": "success",
      "included_in_aggregates": true,
      "memory_units": 42884,
      "name": "fibonacci_15"
    },
    {
      "cpu_units": 15455940,
      "description": "Fibonacci of 20 should return 6765",
      "execution_result": "success",
      "included_in_aggregates": true,
      "memory_units": 57414,
      "name": "fibonacci_20"
    },
    {
      "cpu_units": 19429930,
      "description": "Fibonacci of 25 should return 75025 (original benchmark target)",
      "execution_result": "success",
      "included_in_aggregates": true,
      "memory_units": 71944,
      "name": "fibonacci_25"
    },
    {
      "cpu_units": 471986,
      "description": "Fibonacci of negative number should return the negative number itself based on current implementation",
      "execution_result": "success",
      "included_in_aggregates": true,
      "memory_units": 2302,
      "name": "fibonacci_negative"
    }
  ],
  "execution_environment": {
    "evaluator": "PlutusTx.Eval-1.63.0.0"
  },
  "measurements": {
    "block_cpu_budget_pct": 0.09714965,
    "block_memory_budget_pct": 0.09992222222222223,
    "cpu_units": {
      "maximum": 19429930,
      "median": 3533970,
      "minimum": 471986,
      "sum": 67838022
    },
    "excluded": {
      "count": 0,
      "cpu_units": {
        "maximum": 0,
        "sum": 0
      },
      "memory_units": {
        "maximum": 0,
        "sum": 0
      }
    },
    "execution_fee_lovelace": 19720,
    "memory_units": {
      "maximum": 71944,
      "median": 13824,
      "minimum": 2302,
      "sum": 256986
    },
    "reference_script_fee_lovelace": 1155,
    "script_size_bytes": 77,
    "scripts_per_block": 1000,
    "scripts_per_tx": 229,
    "term_size": 64,
    "total_fee_lovelace": 20875,
    "tx_cpu_budget_pct": 0.1942993,
    "tx_memory_budget_pct": 0.4360242424242424
  },
  "scenario": "fibonacci",
  "timestamp": "2026-08-12T10:54:13Z",
  "version": "2.0.0",
  "notes": "<optional notes>"
}
