{
  "evaluations": [
    {
      "cpu_units": 48138516,
      "description": "PartialUnlock at time=11 with 900 tokens remaining should succeed (first installment unlocked)",
      "execution_result": "success",
      "included_in_aggregates": true,
      "memory_units": 141097,
      "name": "partial_unlock_first_installment"
    },
    {
      "cpu_units": 51048735,
      "description": "PartialUnlock at time=50 with 500 tokens remaining should succeed (half vested)",
      "execution_result": "success",
      "included_in_aggregates": true,
      "memory_units": 147286,
      "name": "partial_unlock_mid_vesting"
    },
    {
      "cpu_units": 51048735,
      "description": "PartialUnlock at time=91 with 100 tokens remaining should succeed (9 installments unlocked)",
      "execution_result": "success",
      "included_in_aggregates": true,
      "memory_units": 147286,
      "name": "partial_unlock_near_end"
    },
    {
      "cpu_units": 51048735,
      "description": "PartialUnlock at time=25 with 800 tokens remaining should succeed (between installment boundaries)",
      "execution_result": "success",
      "included_in_aggregates": true,
      "memory_units": 147286,
      "name": "partial_unlock_between_installments"
    },
    {
      "cpu_units": 11697768,
      "description": "FullUnlock at time=101 (just after vesting period end) should succeed",
      "execution_result": "success",
      "included_in_aggregates": true,
      "memory_units": 35474,
      "name": "full_unlock_after_period_end"
    },
    {
      "cpu_units": 11697768,
      "description": "FullUnlock at time=200 (well after vesting period end) should succeed",
      "execution_result": "success",
      "included_in_aggregates": true,
      "memory_units": 35474,
      "name": "full_unlock_well_after"
    },
    {
      "cpu_units": 24688,
      "description": "Validator fails when redeemer is raw integer 0 instead of constructor 0()",
      "execution_result": "success",
      "included_in_aggregates": false,
      "memory_units": 132,
      "name": "redeemer_integer_0"
    },
    {
      "cpu_units": 24688,
      "description": "Validator fails when redeemer is raw integer 1 instead of constructor 1()",
      "execution_result": "success",
      "included_in_aggregates": false,
      "memory_units": 132,
      "name": "redeemer_integer_1"
    },
    {
      "cpu_units": 24688,
      "description": "Validator fails when redeemer is raw integer 99 (not a valid constructor)",
      "execution_result": "success",
      "included_in_aggregates": false,
      "memory_units": 132,
      "name": "redeemer_integer_99"
    },
    {
      "cpu_units": 24688,
      "description": "Validator fails when redeemer is bytestring instead of constructor",
      "execution_result": "success",
      "included_in_aggregates": false,
      "memory_units": 132,
      "name": "redeemer_bytestring"
    },
    {
      "cpu_units": 24688,
      "description": "Validator fails when redeemer is list [1 2 3] instead of constructor",
      "execution_result": "success",
      "included_in_aggregates": false,
      "memory_units": 132,
      "name": "redeemer_list"
    },
    {
      "cpu_units": 6471276,
      "description": "PartialUnlock without beneficiary signature should fail",
      "execution_result": "success",
      "included_in_aggregates": false,
      "memory_units": 21232,
      "name": "partial_unlock_missing_signature"
    },
    {
      "cpu_units": 7587656,
      "description": "PartialUnlock with impostor signature instead of beneficiary should fail",
      "execution_result": "success",
      "included_in_aggregates": false,
      "memory_units": 21233,
      "name": "partial_unlock_wrong_signature"
    },
    {
      "cpu_units": 6471276,
      "description": "PartialUnlock with no signatures at all should fail",
      "execution_result": "success",
      "included_in_aggregates": false,
      "memory_units": 21232,
      "name": "partial_unlock_no_signatures"
    },
    {
      "cpu_units": 9664264,
      "description": "PartialUnlock at time=5 should fail (before firstUnlockPossibleAfter=10)",
      "execution_result": "success",
      "included_in_aggregates": false,
      "memory_units": 21978,
      "name": "partial_unlock_before_first_unlock"
    },
    {
      "cpu_units": 9664264,
      "description": "PartialUnlock at time=10 should fail (at boundary, must be strictly after firstUnlockPossibleAfter)",
      "execution_result": "success",
      "included_in_aggregates": false,
      "memory_units": 21978,
      "name": "partial_unlock_at_first_unlock"
    },
    {
      "cpu_units": 42388274,
      "description": "PartialUnlock with 0 tokens remaining in output should fail (must use FullUnlock instead)",
      "execution_result": "success",
      "included_in_aggregates": false,
      "memory_units": 126930,
      "name": "partial_unlock_zero_remaining"
    },
    {
      "cpu_units": 42433564,
      "description": "PartialUnlock with output tokens equal to input (1000) should fail (no tokens actually withdrawn)",
      "execution_result": "success",
      "included_in_aggregates": false,
      "memory_units": 126931,
      "name": "partial_unlock_not_decreasing"
    },
    {
      "cpu_units": 44570773,
      "description": "PartialUnlock at time=11 with 800 tokens remaining should fail (expected minimum 900)",
      "execution_result": "success",
      "included_in_aggregates": false,
      "memory_units": 127221,
      "name": "partial_unlock_wrong_remaining_too_low"
    },
    {
      "cpu_units": 44570773,
      "description": "PartialUnlock at time=11 with 950 tokens remaining should fail (must withdraw at least 1 installment)",
      "execution_result": "success",
      "included_in_aggregates": false,
      "memory_units": 127221,
      "name": "partial_unlock_wrong_remaining_too_high"
    },
    {
      "cpu_units": 47864735,
      "description": "PartialUnlock with modified datum on continuing output should fail (datum must be preserved)",
      "execution_result": "success",
      "included_in_aggregates": false,
      "memory_units": 127386,
      "name": "partial_unlock_datum_modified"
    },
    {
      "cpu_units": 44941031,
      "description": "PartialUnlock with no datum on continuing output should fail",
      "execution_result": "success",
      "included_in_aggregates": false,
      "memory_units": 127321,
      "name": "partial_unlock_datum_missing"
    },
    {
      "cpu_units": 26435354,
      "description": "PartialUnlock with two script inputs should fail (double satisfaction attack)",
      "execution_result": "success",
      "included_in_aggregates": false,
      "memory_units": 64550,
      "name": "partial_unlock_double_satisfaction"
    },
    {
      "cpu_units": 6471276,
      "description": "FullUnlock without beneficiary signature should fail",
      "execution_result": "success",
      "included_in_aggregates": false,
      "memory_units": 21232,
      "name": "full_unlock_missing_signature"
    },
    {
      "cpu_units": 7587656,
      "description": "FullUnlock with impostor signature instead of beneficiary should fail",
      "execution_result": "success",
      "included_in_aggregates": false,
      "memory_units": 21233,
      "name": "full_unlock_wrong_signature"
    },
    {
      "cpu_units": 9537768,
      "description": "FullUnlock at time=50 should fail (vesting period not yet ended)",
      "execution_result": "success",
      "included_in_aggregates": false,
      "memory_units": 21974,
      "name": "full_unlock_before_period_end"
    },
    {
      "cpu_units": 9537768,
      "description": "FullUnlock at time=100 should fail (at boundary, must be strictly after vestingPeriodEnd)",
      "execution_result": "success",
      "included_in_aggregates": false,
      "memory_units": 21974,
      "name": "full_unlock_at_period_end"
    },
    {
      "cpu_units": 9041792,
      "description": "PartialUnlock with no lower bound (-inf) should fail; the lower bound must be finite",
      "execution_result": "success",
      "included_in_aggregates": false,
      "memory_units": 21753,
      "name": "partial_unlock_infinite_lower_bound"
    },
    {
      "cpu_units": 8915296,
      "description": "FullUnlock with no lower bound (-inf) should fail; the lower bound must be finite",
      "execution_result": "success",
      "included_in_aggregates": false,
      "memory_units": 21749,
      "name": "full_unlock_infinite_lower_bound"
    }
  ],
  "execution_environment": {
    "evaluator": "PlutusTx.Eval-1.63.0.0"
  },
  "measurements": {
    "block_cpu_budget_pct": 0.255243675,
    "block_memory_budget_pct": 0.2045638888888889,
    "cpu_units": {
      "maximum": 51048735,
      "median": 49593625,
      "minimum": 11697768,
      "sum": 224680257
    },
    "excluded": {
      "count": 23,
      "cpu_units": {
        "maximum": 47864735,
        "sum": 384278236
      },
      "memory_units": {
        "maximum": 127386,
        "sum": 1065788
      }
    },
    "execution_fee_lovelace": 53930,
    "memory_units": {
      "maximum": 147286,
      "median": 144191,
      "minimum": 35474,
      "sum": 653903
    },
    "reference_script_fee_lovelace": 16200,
    "script_size_bytes": 1080,
    "scripts_per_block": 391,
    "scripts_per_tx": 112,
    "term_size": 1066,
    "total_fee_lovelace": 70130,
    "tx_cpu_budget_pct": 0.51048735,
    "tx_memory_budget_pct": 0.8926424242424242
  },
  "scenario": "linear_vesting",
  "timestamp": "2026-08-12T10:54:23Z",
  "version": "2.0.0",
  "notes": "Generated using UPLC-CAPE measure tool"
}
