{
  "evaluations": [
    {
      "cpu_units": 794397,
      "description": "ECD of 0 and 12 should return 12 (edge case: first argument is zero)",
      "execution_result": "success",
      "included_in_aggregates": true,
      "memory_units": 3304,
      "name": "ecd_0_12"
    },
    {
      "cpu_units": 401723,
      "description": "ECD of 12 and 0 should return 12 (edge case: second argument is zero)",
      "execution_result": "success",
      "included_in_aggregates": true,
      "memory_units": 2002,
      "name": "ecd_12_0"
    },
    {
      "cpu_units": 794397,
      "description": "ECD of 7 and 7 should return 7 (edge case: identical numbers)",
      "execution_result": "success",
      "included_in_aggregates": true,
      "memory_units": 3304,
      "name": "ecd_7_7"
    },
    {
      "cpu_units": 1579745,
      "description": "ECD of 6 and 9 should return 3",
      "execution_result": "success",
      "included_in_aggregates": true,
      "memory_units": 5908,
      "name": "ecd_6_9"
    },
    {
      "cpu_units": 1187071,
      "description": "ECD of 12 and 8 should return 4",
      "execution_result": "success",
      "included_in_aggregates": true,
      "memory_units": 4606,
      "name": "ecd_12_8"
    },
    {
      "cpu_units": 1972419,
      "description": "ECD of 15 and 25 should return 5",
      "execution_result": "success",
      "included_in_aggregates": true,
      "memory_units": 7210,
      "name": "ecd_15_25"
    },
    {
      "cpu_units": 1972419,
      "description": "ECD of 17 and 19 should return 1 (coprime numbers)",
      "execution_result": "success",
      "included_in_aggregates": true,
      "memory_units": 7210,
      "name": "ecd_17_19"
    },
    {
      "cpu_units": 1972419,
      "description": "ECD of 13 and 29 should return 1 (coprime numbers)",
      "execution_result": "success",
      "included_in_aggregates": true,
      "memory_units": 7210,
      "name": "ecd_13_29"
    },
    {
      "cpu_units": 1579745,
      "description": "ECD of 48 and 18 should return 6",
      "execution_result": "success",
      "included_in_aggregates": true,
      "memory_units": 5908,
      "name": "ecd_48_18"
    },
    {
      "cpu_units": 1187071,
      "description": "ECD of 100 and 75 should return 25",
      "execution_result": "success",
      "included_in_aggregates": true,
      "memory_units": 4606,
      "name": "ecd_100_75"
    },
    {
      "cpu_units": 1579745,
      "description": "ECD of 1071 and 462 should return 21 (larger numbers)",
      "execution_result": "success",
      "included_in_aggregates": true,
      "memory_units": 5908,
      "name": "ecd_1071_462"
    },
    {
      "cpu_units": 1187071,
      "description": "ECD of 2520 and 1890 should return 630 (larger numbers)",
      "execution_result": "success",
      "included_in_aggregates": true,
      "memory_units": 4606,
      "name": "ecd_2520_1890"
    },
    {
      "cpu_units": 1187071,
      "description": "ECD of -12 and 8 should return 4 (negative first argument handled via abs)",
      "execution_result": "success",
      "included_in_aggregates": true,
      "memory_units": 4606,
      "name": "ecd_negative_12_8"
    },
    {
      "cpu_units": 1352279,
      "description": "ECD of 12 and -8 should return 4 (negative second argument handled via abs)",
      "execution_result": "success",
      "included_in_aggregates": true,
      "memory_units": 5008,
      "name": "ecd_12_negative_8"
    }
  ],
  "execution_environment": {
    "evaluator": "PlutusTx.Eval-1.68.0.0"
  },
  "measurements": {
    "block_cpu_budget_pct": 0.009862095,
    "block_memory_budget_pct": 0.01001388888888889,
    "cpu_units": {
      "maximum": 1972419,
      "median": 1269675,
      "minimum": 401723,
      "sum": 18747572
    },
    "excluded": {
      "count": 0,
      "cpu_units": {
        "maximum": 0,
        "sum": 0
      },
      "memory_units": {
        "maximum": 0,
        "sum": 0
      }
    },
    "execution_fee_lovelace": 5472,
    "memory_units": {
      "maximum": 7210,
      "median": 4807,
      "minimum": 2002,
      "sum": 71396
    },
    "reference_script_fee_lovelace": 7530,
    "script_size_bytes": 502,
    "scripts_per_block": 9986,
    "scripts_per_tx": 2288,
    "term_size": 440,
    "total_fee_lovelace": 13002,
    "tx_cpu_budget_pct": 0.01972419,
    "tx_memory_budget_pct": 0.04369696969696969
  },
  "scenario": "ecd",
  "timestamp": "2026-09-03T09:09:18Z",
  "version": "2.0.0"
}
